{
  "asset_index_path": "bundles/candidate-core-v2-20260829-shadow/asset-index.json",
  "asset_index_sha256": "ee7389391fbff9f16f8fd5aa447f9e749ff54a74e5cbe5ba03b95472342d78e3",
  "bundle_id": "candidate-core-v2-20260829-shadow",
  "evidence": {
    "clean_report_id": "clean-report-g0-candidate-shadow-20260829",
    "index_id": "evidence-index-g0-candidate-shadow-20260829",
    "replay_report_id": "replay-report-g0-candidate-shadow-20260829",
    "shadow_report_id": "shadow-report-g0-candidate-shadow-20260829",
    "test_report_id": "test-report-g0-candidate-shadow-20260829"
  },
  "evidence_index_path": "evidence/g0-candidate-core-v2-20260829/evidence-index.json",
  "evidence_index_sha256": "8d42ca289222125e97882cb2bb2b11e43e02235bf4aa5a7c3ad33ed0cb796cf9",
  "execution_mode": "shadow",
  "generated_at": "2026-08-29T00:00:00Z",
  "generator": {
    "tool": "build_candidate_bundle.py",
    "version": "1.0.0"
  },
  "input_policy": {
    "owner": "legacy",
    "real_input_enabled": false,
    "reason": "G0 Candidate/Shadow bundle; Core v2 never owns live input."
  },
  "lifecycle": "candidate",
  "local_files": [
    {
      "path": "bundles/candidate-core-v2-20260829-shadow/asset-index.json",
      "sha256": "ee7389391fbff9f16f8fd5aa447f9e749ff54a74e5cbe5ba03b95472342d78e3",
      "size_bytes": 5207
    },
    {
      "path": "bundles/candidate-core-v2-20260829-shadow/runtime-manifest.json",
      "sha256": "ea3d093ba476a7e0aa8de1d8c4508507d1d8863cddf3de7f80ec5ff6f1ef0e10",
      "size_bytes": 2702
    },
    {
      "path": "configs/pilot-subject-01.profile.json",
      "sha256": "891e9ad6d3205c12ab60176e87524ba5b638554652eb45b55a6f4fe01604603f",
      "size_bytes": 347
    },
    {
      "path": "configs/pilot-subject-01.resolved.json",
      "sha256": "5d57809b0ec4f81d3a0551bcdbebd6ce296179ebdd38f87191113c0f81a017b6",
      "size_bytes": 1518
    },
    {
      "path": "configs/requirements.lock",
      "sha256": "00bbe87dc673c8065603bd584c464638113dbf921f96220c154ce545816155fa",
      "size_bytes": 904
    },
    {
      "path": "evidence/clean-smoke/artifacts/maple_automation_core-0.1.0-py3-none-any.whl",
      "sha256": "3c4b37fe04ec0e82bb85e4dab9faecf01044dcdc48f97f8001166ab851817b81",
      "size_bytes": 33330
    },
    {
      "path": "evidence/clean-smoke/artifacts/maple_automation_core-0.1.0.tar.gz",
      "sha256": "8d06487f1cdc3791c439383c539435cacfdc2e505bc95d2ee97fe38b5aa7c708",
      "size_bytes": 43329
    },
    {
      "path": "evidence/clean-smoke/clean-coverage.xml",
      "sha256": "c71a9e9bebc235200ee311bd8c75ad5b709eac76faf7176b1825585d38f46062",
      "size_bytes": 68446
    },
    {
      "path": "evidence/clean-smoke/clean-junit.xml",
      "sha256": "b923cf260f48ee66faca617676be3b98a0bb0e1d05b60f7a96013cb7ec661b74",
      "size_bytes": 12970
    },
    {
      "path": "evidence/clean-smoke/clean-replay-report.json",
      "sha256": "f16b275a4d3b1a935c911b204a5c0c70f1f712cf8bc184d09a12aa52ade3d66c",
      "size_bytes": 4789
    },
    {
      "path": "evidence/clean-smoke/clean-shadow-report.json",
      "sha256": "c3924d60f93550653639c70dec778b8e50eb699a84f330765cb03e9e5fe4efb6",
      "size_bytes": 5456
    },
    {
      "path": "evidence/clean-smoke/clean-smoke-report.json",
      "sha256": "c0ed6d84d01a5b94464d9078e53f1c4c87c31a11a677e8e1018c2657b3b888e5",
      "size_bytes": 35368
    },
    {
      "path": "evidence/g0-candidate-core-v2-20260829/build-report.json",
      "sha256": "0c103e0a0293cef746ad6729e5f5348496b16bb5f4d41e3f7ccb1e6c5fcd890f",
      "size_bytes": 1628
    },
    {
      "path": "evidence/g0-candidate-core-v2-20260829/clean-report.json",
      "sha256": "bc959ea01b9415377d00b8fc6a48caf76df696d7446d60a51c80cc44831ff18a",
      "size_bytes": 1413
    },
    {
      "path": "evidence/g0-candidate-core-v2-20260829/dependency-report.json",
      "sha256": "08aaaeba791d25eed89e0a1db28118085e1d595525c37c2a80e29f1016abd635",
      "size_bytes": 1445
    },
    {
      "path": "evidence/g0-candidate-core-v2-20260829/evidence-index.json",
      "sha256": "8d42ca289222125e97882cb2bb2b11e43e02235bf4aa5a7c3ad33ed0cb796cf9",
      "size_bytes": 6417
    },
    {
      "path": "evidence/g0-candidate-core-v2-20260829/hash-report.json",
      "sha256": "aae5252f4a6d625d223d73347a2eaf37eb67f67103095c1efa2536a4b2f1d208",
      "size_bytes": 1009
    },
    {
      "path": "evidence/g0-candidate-core-v2-20260829/manifest-report.json",
      "sha256": "865fa60a68343f30f8748ec1ea75e76386961634436f0754b47f25e2d4b96d57",
      "size_bytes": 1251
    },
    {
      "path": "evidence/g0-candidate-core-v2-20260829/replay-report.json",
      "sha256": "3a211255a77effe6c7743db76497660c37cd27143b54a86a990a3aa40b82a059",
      "size_bytes": 1660
    },
    {
      "path": "evidence/g0-candidate-core-v2-20260829/shadow-report.json",
      "sha256": "523761dbdcca14617d4aef57a899fd3e45bc77909d3f3374c3304ed64d01b0a6",
      "size_bytes": 1737
    },
    {
      "path": "evidence/g0-candidate-core-v2-20260829/test-report.json",
      "sha256": "c8db5a26904721be4a92bb2f4bcebe81f0b0c08da8831d6241495c194792b2f0",
      "size_bytes": 1834
    }
  ],
  "manifest_asset_bindings": {
    "classes_sha256": "classes",
    "effective_config_sha256": "effective-config",
    "map_fingerprint": "map-registry",
    "model_sha256": "model",
    "movement_profile_sha256": "movement-profile",
    "platform_graph_sha256": "platform-graph",
    "profile_sha256": "profile",
    "receiver_hash": "receiver",
    "route_manifest_sha256": "route-manifest",
    "split_sha256": "dataset-split"
  },
  "manifest_path": "bundles/candidate-core-v2-20260829-shadow/runtime-manifest.json",
  "manifest_sha256": "ea3d093ba476a7e0aa8de1d8c4508507d1d8863cddf3de7f80ec5ff6f1ef0e10",
  "release_id": "candidate-core-v2-20260829-shadow",
  "rollback": {
    "action": "stop-core-v2-and-keep-legacy-input",
    "target": "legacy-input-owner"
  },
  "schema_version": "1.0.0",
  "source": {
    "core_commit": "21d4cc66129ce834901d4d0bb230534c2b7517d4",
    "core_repository": "local:maple-automation-core",
    "upstream_commit": "3e19173f8da5aab8405307bb9c6e3741dd3abd6b",
    "upstream_repository": "git:upstream/MapleStoryAutoLevelUp"
  },
  "subject_id": "subject-01"
}
